{
  "schema_version": "1.0",
  "state": "CANDIDATE_REQUIRED",
  "baseline_snapshot": "2026-09-29",
  "candidate_snapshot_date": "2026-10-13",
  "changed_sources": [
    "WAHAPEDIA_11E",
    "BSDATA_WH40K_11E"
  ],
  "candidate_revisions": {
    "wahapedia": {
      "baseline_last_update": "2026-09-28 02:38:04",
      "candidate_last_update": "2026-10-12 02:57:26",
      "changed_files": 19,
      "changed_files_detail": [
        {
          "file": "Last_update.csv",
          "snapshot_sha256": "4b3a7e63006be965073bdc34022bdd17f6f7b063602b46a4640a11ac641b20a9",
          "live_sha256": "10b36a73048c8942214ed6bf843076fa3436a497875b23666c45ea0cea276b93",
          "snapshot_bytes": 39,
          "live_bytes": 39
        },
        {
          "file": "Source.csv",
          "snapshot_sha256": "e6f74afb7b43f6779ec9a03ad0699ff11dd27b9d2f08243d5c04dd07fd99f6e0",
          "live_sha256": "9edef70bb50d0d4a2daaf368fe1b409b0a8f71bb04a24af630ab7eea1ff35c33",
          "snapshot_bytes": 8432,
          "live_bytes": 7588
        },
        {
          "file": "Datasheets.csv",
          "snapshot_sha256": "ba363e9a68e6d7ee19f93a32abc06ba3f6a5f1efd0da5aaab32701a130a15623",
          "live_sha256": "b107a16c21e4ceeb3c73ba742d9d48944d762c29f8b1a7fa2dff21a1a2a91ef0",
          "snapshot_bytes": 876603,
          "live_bytes": 792442
        },
        {
          "file": "Datasheets_models.csv",
          "snapshot_sha256": "dddb131c2b81fa199832f5250f0469f7cef4ba4fef77b6e477380b592d61e6ff",
          "live_sha256": "2dc135f06154d05358772a95c83ec50bd4d2f72d4be9e6d15f9005b4bac91c11",
          "snapshot_bytes": 107314,
          "live_bytes": 101108
        },
        {
          "file": "Datasheets_models_cost.csv",
          "snapshot_sha256": "2e2f9be00eae5924a62dd27c4322bdb6b663070fd80781a81ca1b5305ed24c47",
          "live_sha256": "5e563fe074fdbcc4324cbcedf2ad31f8febec92de42ff6d35547a4f98453c1d3",
          "snapshot_bytes": 189351,
          "live_bytes": 162956
        },
        {
          "file": "Datasheets_keywords.csv",
          "snapshot_sha256": "10cb386fc3134257bdf3bad3bb1fd94615ea94a5fe3c94aad874da390b1ec1df",
          "live_sha256": "3ce281c28a45bb588d606b6d4ed8849423c00fc9fdf7fe7d6fd7bcb8ebc4be7c",
          "snapshot_bytes": 476771,
          "live_bytes": 379908
        },
        {
          "file": "Datasheets_wargear.csv",
          "snapshot_sha256": "eeaa33777769367d836cab0562a82bb84bcb8fc1a8064539a58ead972d302241",
          "live_sha256": "4710cc0d3ab56dba22bd6a782b9bd154d94179d033ebaf1374e12668e28a0dd6",
          "snapshot_bytes": 632930,
          "live_bytes": 548961
        },
        {
          "file": "Datasheets_options.csv",
          "snapshot_sha256": "4b729297fe68b3c7cfc2c99205610a1741f838e29ae7150501d84365882e8d13",
          "live_sha256": "acd49655a7a079bb73a08924ab36e7d6211aeba211fa770c2b97099d13c8cbe2",
          "snapshot_bytes": 371173,
          "live_bytes": 309442
        },
        {
          "file": "Datasheets_unit_composition.csv",
          "snapshot_sha256": "fca0b694f146a13f56c828d78f2aaa0dbe79341273173c68f534b8985494b03f",
          "live_sha256": "08739dbb5ba785abb26649e93b203872f3fe0e9d0d90fd88bc0894d2255e3245",
          "snapshot_bytes": 85472,
          "live_bytes": 77534
        },
        {
          "file": "Abilities.csv",
          "snapshot_sha256": "f3fc44a0fd91b7b45b38ae477632517e732bda64b4a0c548033a9f874664c7f3",
          "live_sha256": "423445d62af52561dabe0d569698badee1da4e6cee5b70c51e4a0357fa6169bd",
          "snapshot_bytes": 202161,
          "live_bytes": 195331
        },
        {
          "file": "Datasheets_abilities.csv",
          "snapshot_sha256": "5aba5ff1d7a2353904fac32d2b2b234c03573bef418f1bf4afabca1001cc2109",
          "live_sha256": "15fbc6f9c9d71ba9a05542279e0775d4a4673313acaf0706224f07357fbe9ffc",
          "snapshot_bytes": 961930,
          "live_bytes": 872474
        },
        {
          "file": "Datasheets_leader.csv",
          "snapshot_sha256": "c75b00eed968babbc89c6b7e077b40f7234c3040537816692ae0e609ebca174c",
          "live_sha256": "03df5237cbc90423edb2214dda431a1deb1da177c9ea3014e53fc9d6a771b9e3",
          "snapshot_bytes": 35117,
          "live_bytes": 27879
        },
        {
          "file": "Detachments.csv",
          "snapshot_sha256": "445af298071f5014f7f1e49e55669b4a6bbaf8e798d95717d9ea85fb94314e5e",
          "live_sha256": "b66856c65240595978fd18a603649727a910045489d0e1f83f49ca6d3e520624",
          "snapshot_bytes": 147249,
          "live_bytes": 127591
        },
        {
          "file": "Stratagems.csv",
          "snapshot_sha256": "2ed24cacbe826c4eccea0920385669ac2fea5ebf3aca8822169d15d03f5814cb",
          "live_sha256": "3ee6b09202194a57edf44838b5c976778be3c33781bc550c8ca98ec1083f7aa1",
          "snapshot_bytes": 1148707,
          "live_bytes": 1045219
        },
        {
          "file": "Datasheets_stratagems.csv",
          "snapshot_sha256": "7dacd927c0cf17b3516fdad5344e6d9f569bf172f3fbfe6a96e010bcfea5b67c",
          "live_sha256": "e00f2b610963953b9df169737bc9e11832e2f3bd4d070624b17cc323f1a9d9c1",
          "snapshot_bytes": 2150631,
          "live_bytes": 1376806
        },
        {
          "file": "Enhancements.csv",
          "snapshot_sha256": "7e7fa39c9e1f9d268bda75affa8cd647c72b5511726631a8ee4110c8e86bc212",
          "live_sha256": "03f0caed1bf891e88259848fb96d246a9997fd169b03a465de930d15d7a8645b",
          "snapshot_bytes": 477886,
          "live_bytes": 427440
        },
        {
          "file": "Datasheets_enhancements.csv",
          "snapshot_sha256": "1d6576003a346565168369b75efc586d3c12a766d8514571ed81ff333d241376",
          "live_sha256": "feb05c53eba238910abdd63833e0d15110c24068f5bd69a06bd59f21853a3889",
          "snapshot_bytes": 285258,
          "live_bytes": 184533
        },
        {
          "file": "Detachment_abilities.csv",
          "snapshot_sha256": "d7e4966e2b094d43feaa88a66e10608301ff817d92393b9c7f04ec2ac1ed6a44",
          "live_sha256": "c8ad9bf4e306c6a687459d7a76a26074f32983aee63ca73c2ea8a382e4ff52c1",
          "snapshot_bytes": 324910,
          "live_bytes": 289532
        },
        {
          "file": "Datasheets_detachment_abilities.csv",
          "snapshot_sha256": "843395ebfa4f2dceab87b56792fff48d03d861cbfcb1eda6df3bbf2fe822ba38",
          "live_sha256": "2c743c66793a07be95ffcca98c20f9780561da1ab75a34c17abb538fedd8c932",
          "snapshot_bytes": 354262,
          "live_bytes": 190494
        }
      ]
    },
    "bsdata_wh40k_11e": {
      "pinned": "951d5900d1b4a952a4ba560a30c43788e622ccfc",
      "candidate": "043d05b5013babc96f22100c9e015ed052d3be32",
      "changed": true
    },
    "bsdata_mfm_11e": {
      "pinned": "8e0e635674018969fdcfaa64e83d4153ebefad70",
      "candidate": "8e0e635674018969fdcfaa64e83d4153ebefad70",
      "changed": false
    }
  },
  "stages": [
    {
      "id": "WAHAPEDIA_INGEST",
      "source": "WAHAPEDIA_11E",
      "automation": "AUTOMATED_CANDIDATE",
      "description": "Download current Wahapedia 11E CSV export into an isolated candidate snapshot."
    },
    {
      "id": "WAVE_B_RECONCILE",
      "source": "MULTI_SOURCE",
      "automation": "AUTOMATED_CANDIDATE",
      "description": "Reconcile candidate/current Wahapedia structure against current MFM and candidate/current BSData."
    },
    {
      "id": "WAVE_B_ROSTER_VIEWS",
      "source": "WAHAPEDIA_11E",
      "automation": "AUTOMATED_CANDIDATE",
      "description": "Build candidate roster-specific structural views."
    },
    {
      "id": "WAHAPEDIA_SEMANTIC_AUDIT",
      "source": "WAHAPEDIA_11E",
      "automation": "AUTOMATED_CANDIDATE",
      "description": "Verify candidate semantic fingerprints against the live Wahapedia export."
    },
    {
      "id": "OFFICIAL_ASSET_AUDIT",
      "source": "GW_40K_DOWNLOADS",
      "automation": "AUTOMATED_CANDIDATE",
      "description": "When the mirror source catalog changes, verify its referenced official Games Workshop PDF assets before promotion."
    },
    {
      "id": "BSDATA_FALLBACK_REBUILD",
      "source": "BSDATA_WH40K_11E",
      "automation": "AUTOMATED_CANDIDATE",
      "description": "Rebuild structured-implementation fallback views at the candidate BSData revision."
    }
  ],
  "blockers": [],
  "promotion": {
    "auto_promote": false,
    "state": "REVIEW_REQUIRED_AFTER_CANDIDATE_PASS",
    "required_review": true,
    "rule": "Candidate generation and reconciliation may be automatic; promotion to current/normative state is never automatic."
  },
  "plan_fingerprint": "f1371c0e3baf90f32eab480d4c105a871d0bbe5a4563a4338b51ebee3e8c7cd1",
  "plan_id": "REINGEST_f1371c0e3baf"
}
